title,newspaper,url,published_at,plain_text,keyword,relevance_score,source
BCP eliminará cuentas de yape creadas con DNI a partir del 1 de abril,larazon.pe,https://larazon.pe/bcp-eliminara-cuentas-de-yape-creadas-con-dni-a-partir-del-1-de-abril/,2023-02-24 14:15:00+00:00,"Esta medida será necesaria para quienes crearon sus cuentas con DNI antes del 3 de setiembre del 2022.
Lee también:
Atención, «yaperos». Los usuarios de Yape que se afiliaron a la aplicación solo con su documento nacional de identidad (DNI) tendrán que migrar a la nueva Cuenta Yape con DNI para poder disfrutar de todos sus beneficios y funcionalidades. Esta nueva cuenta posee el respaldo de una cuenta bancaria.
Desde el 1 de abril del presente año, si un usuario de la aplicación ingresa al aplicativo solo podrá renovar su cuenta o desafiliarse y crear una nueva para que pueda seguir yapeando.
Esta medida será necesaria para los usuarios que crearon sus cuentas antes del 3 de setiembre del año pasado.
“Actualmente más de medio millón de yaperos ya migraron a la nueva Cuenta Yape con DNI, con la que pueden acceder a todas las funcionalidades que hoy ofrece Yape, como la recarga de celular, el pago de servicios, el acceso a promociones, entre otros”, señaló Yape en un comunicado.
Al momento de migrar a la nueva Cuenta Yape con DNI se le creará a cada usuario una cuenta BCP de manera automática, para usarla exclusivamente con la billetera móvil.
Los usuarios no deben preocuparse porque tanto el monto que tenían guardado en la aplicación, así como los movimientos en su cuenta actual migrarán de forma automática a la nueva cuenta Yape con DNI.
¿Las cuentas con DNI serán eliminadas?
La aplicación señala que los usuarios que tomen la decisión de desafiliarse, y tengan dinero, se les realizará un giro en un plazo de tres días hábiles y podrán cobrarlo en cualquier agencia del Banco de Crédito del Perú (BCP)
Si un usuario de la aplicación no migra su cuenta desde el 1 de abril, la cuenta no se eliminará de forma automática. Sin embargo, para que los yaperos puedan seguir usando la aplicación tendrán que migrar a la nueva cuenta.
“Todos los cambios que realizamos en Yape siempre están orientados a ofrecer la mejor experiencia a nuestros usuarios, de manera que podemos generar valor en su día a día con soluciones seguras, rápidas y sencillas”, señaló Yape.
¿Cómo puedo crearme una cuenta de ahorros Yape?
-Ingresa al menú (las 3 rayitas al lado superior izquierdo de la pantalla).
-Selecciona la opción «Renovar mi Yape».
-Elige «Empezar».
-Confirma el dinero que se va a transferir a tu nueva Cuenta Yape con DNI.
-Sigue las instrucciones para validar tu identidad.","Yape, Yapear, Yapeo",100.0,GDELT
Perú Sostenible y Ciudadanos al Día se unen para premiar las  Buenas Prácticas en Gestión Pública  ,commondigital.commonperu.com,http://www.commondigital.commonperu.com/index.php/locales/44935-peru-sostenible-y-ciudadanos-al-dia-se-unen-para-premiar-las-buenas-practicas-en-gestion-publica,2023-02-24 06:00:00+00:00,"Perú Sostenible y Ciudadanos al Día se unen para premiar las “Buenas Prácticas en Gestión Pública”
En el marco de la Agenda 2030, hay objetivos importantes que atender y uno de ellos involucra la consolidación de la articulación del sector público y privado. Es así como Perú Sostenible, red de empresas que promueve el desarrollo sostenible, en colaboración con Ciudadanos al Día (CAD) han promovido la categoría Cooperación Público - Privada del premio a las Buenas Prácticas en Gestión Pública, iniciativa que desde el año 2005 fomenta y promueve la identificación, reconocimiento y divulgación de iniciativas lideradas por entidades públicas, y su colaboración con agentes del sector privado, la academia y la sociedad civil, que han producido destacados resultados en beneficio de la ciudadanía.
En este sentido, el 05 de septiembre de este año, Ciudadanos al Día (CAD) organizó la ceremonia de reconocimiento, donde se premiaron a las iniciativas ganadoras en las diferentes categorías y premios especiales, entre las cuales resaltó la práctica “Cobro de subsidios monetarios otorgados por el Estado en el contexto de COVID-19” a través de billeteras digitales para ciudadanos en pobreza y vulnerabilidad, promoviendo la inclusión financiera del Programa Nacional de Asistencia Solidaria Pensión 65, la misma que a criterio del Jurado del Premio resultó ganadora de la categoría de Cooperación Público Privada.
Esta iniciativa surgió en el marco de la emergencia sanitaria, producto de la pandemia, en donde empezaron los subsidios monetarios por parte del Estado en septiembre del 2020, y en donde se identificó que el 57% de beneficiarios no eran parte del sistema financiero, lo cual significaba que esa población requiera trasladarse a una agencia bancaria cercana. Y en ese marco, se presentó una reducción de la capacidad operativa, aforo y/o cierre de las agencias bancarias para el cobro del Bono 600 y Bono Yanapay. En este sentido, la problemática generó la aglomeración de beneficiarios en las agencias bancarias, traslados infructuosos, costos de traslado y riesgo a exposición del COVID-19.
De esta manera, el Programa Pensión 65 junto a entidades financieras tales como Banco de Crédito (Yape), Banco Interbank (Tunki), Compartamos Financiera (BIM), Caja Rural de Ahorro y Crédito Los Andes S.A y Banco de la Nación; realizaron un trabajo articulado para determinar las entidades financieras que expresan voluntad para adherirse al proceso de pago y las modalidades de pago disponibles, implementando como alternativa el uso de billeteras digitales que permite una mayor rapidez de ejecución del cobro, la inclusión financiera de los beneficiarios, evita la presencialidad, costos y exposición al riesgo de contagio en el contexto del COVID-19 y que demuestra que una alianza público-privada puede cerrar brechas de atención a las poblaciones en situación de pobreza y/o vulnerables, favoreciendo su inclusión financiera.
Como principales resultados, se tuvieron que a través de esta modalidad se varía de 82,795 (personas incorporadas a esta modalidad en subsidios monetarios) a 1,059,302 quienes son incorporados en el sistema financiero formal del país; y por ello, con capacidad para acceder a productos financieros. Con ello, se pudo ejecutar acciones de cobro a través de un medio digital sin el contacto directo con el papel moneda; y, se reduce el tiempo de cobro, reducción del costo de cobro subsidios económicos que, de haber sido programados en alguna modalidad de cobro con requerimiento de presencialidad física en una agencia bancaria, les hubiera demandado un esfuerzo económico de S/ 13.00 per cápita.
Iniciativas como estas demuestran resultados positivos de articulación de distintos actores como el sector público, privado y sociedad civil que generan un país más próspero.","Yape, Yapear, Yapeo",10.0,GDELT
Se complica el estado de salud de una las niñas que resultó con quemaduras de tercer grado,diariovoces.com.pe,https://diariovoces.com.pe/229804/se-complica-el-estado-de-salud-de-una-las-ninas,2023-02-25 16:45:00+00:00,"Tras recibir injerto de piel la menor fue ingresada a Cuidados Intensivos
Las dos niñas que resultaron con quemaduras de tercer grado fueron sometidas a intervenciones quirúrgica para trasplante de piel, sin embargo, la menor de ella se encuentra intubada en la Unidad de Cuidados Intensivos del Hospital de San Borja a donde fueron referidas y la mayor de cuatro años comenzó a reaccionar favorablemente.
María Salas, tía de las niñas manifestó su agradecimiento por el apoyo que vienen recibiendo, tal como lo hicieron ayer las integrantes de la asociación de damas Manos Unidas, quienes entregaron 417 soles, dinero recaudado en colectas en el centro de Tarapoto, también ropa y gasas quirúrgicas que fueron donados por el Colegio Médico y servirán para el tratamiento de las dos hermanitas.
La familia Reyes Fasanando requieren de más apoyo, ya que seguirán en Lima por un tiempo indeterminado y en la capital de la República no tienen familiares y las personas que deseen ayudarles con un aporte económico, lo pueden hacer mediante sistema Yape al 950 434 671. “Gracias quienes de corazón no están ayudando con un granito de arena. También necesitamos que nos ayuden con sus oraciones para que mis sobrinas se recuperen pronto” indicó María Salas. (Hugo Anteparra)","Yape, Yapear, Yapeo",10.0,GDELT
Transferencias entre Yape y Plin no tendrán costo : ¿ Cómo funcionará y desde cuándo ? ,peru-retail.com,https://www.peru-retail.com/transferencias-entre-yape-y-plin-no-tendran-costo-como-funcionara-y-desde-cuando/,2023-02-28 18:00:00+00:00,"Debido a que las billeteras digitales han tomado gran protagonismo en el mercado desde 2016 y al menos la mitad de los peruanos las utilizan para realizar pagos, en octubre de 2022 el Banco Central de Reserva del Perú (BCR) publicó el reglamento de interoperabilidad que exige que estas e-Wallet operen entre sí en beneficio de los usuarios.
En tanto, tras la regulación del BCR, se podrá realizar transferencias entre Yape y Plin desde finales de marzo de 2023. De esta manera, ahora los peruanos tendrán la opción de yapear o plinear a un usuario de la billetera electrónica del competidor.
Por lo tanto, Yape y Plin tienen hasta el 31 de marzo para adaptar sus procesos. Ambas billeteras digitales afirmaron al diario La República que no cobrarán ninguna comisión por la transferencia de dinero.
En esta línea, Miguel Ibáñez, product owner de Yape y líder del proceso de interoperabilidad, aseguró al medio citado que Yape no cobrará comisiones por las transferencias a otras billeteras.
Subrayó que Yape nació con el objetivo de ser interoperable, por lo cual los yaperos deben tener la tranquilidad de que no se les va a cobrar ni un sol por dichas transacciones. “Prueba de ello es que actualmente ya interoperamos con otras nueve entidades”, destacó Ibáñez.
Billeteras digitales trabajan en conjunto para sacar adelante el proyecto
Mientras que Mauricio Sánchez, head de Plin, señaló que las billeteras digitales están trabajando en conjunto y a buen ritmo para sacar adelante el proyecto dentro del plazo otorgado por el BCR.
Lea también: Usuarios podrán realizar transferencias entre Yape y Plin: ¿desde cuándo?
Sánchez puntualizó que se han definido distintos hitos que buscan asegurar el correcto funcionamiento y que este sea un proyecto exitoso para continuar conectando financieramente a los peruanos. Así, esperan que como resultado se promueva la inclusión financiera, la digitalización de los medios de pago y la disminución del uso de efectivo.
¿Cómo se realizarán las transferencias entre Yape y Plin?
Las operaciones entre las billeteras digitales se realizarán utilizando el número de celular de los usuarios, el que ya se tiene agregado como contacto o un número celular que se ingrese en ese momento. No obstante, en la segunda fase, que tiene como fecha límite el 30 de junio, las trasferencias también podrán efectuarse mediante la lectura de un código QR.
Cabe destacar que más de 12 millones de usuarios de Yape y más de 10 millones de clientes de Plin se verán beneficiados con esta funcionalidad.
BCR sancionará a billeteras digitales que no cumplan con sus obligaciones
Recordemos que las billeteras digitales pueden ser sancionadas por el Banco Central de Reserva con una multa de 5 UT (S/ 24.750) semanales hasta que cumplan con sus obligaciones, como iniciar la interoperabilidad dentro del plazo indicado, cumplir con los lineamientos de experiencia de usuarios, entre otros.
También la multa sería más grave por no informar de ningún cambio al BCR. Las multas tendrían un valor mínimo de 1,5 UIT y máximo de 20 UIT por día de retraso.
Si deseas conocer más sobre la regulación del Banco Central de Reserva ingresa a esta nota de Perú Retail.
lea también: BCP eliminará cuenta de Yape con DNI desde el 1 de abril: ¿Qué pasará con mi saldo?","Yape, Yapear, Yapeo",70.0,GDELT
